{
  "name": "car-rental",
  "description": "Owners let someone use their car for a day or a week, for money.",
  "roles": [
    { "role": "owner", "posts": "offers" },
    { "role": "renter", "posts": "requests" }
  ],
  "offer": {
    "description": { "type": "text", "description": "The car and its terms, or the car looked for." },
    "price": { "type": "money", "description": "The price per day or per week." },
    "payment": { "type": "words", "description": "How the rental may be paid: direct, rental, or both." },
    "place": { "type": "place", "description": "Where the car is picked up and returned." },
    "dates": { "type": "moment", "description": "When the car is free, or wanted: from pickup to return." },
    "kind": { "type": "choice", "description": "The kind of car.", "values": ["small", "sedan", "wagon", "suv", "van", "pickup", "sports"] },
    "transmission": { "type": "choice", "description": "The gearbox.", "values": ["automatic", "manual"] },
    "fuel": { "type": "choice", "description": "What the car runs on.", "values": ["petrol", "diesel", "hybrid", "electric"] },
    "deposit": { "type": "money", "description": "Money held against damage, given back when the car returns as it left." },
    "insurance": { "type": "text", "description": "What insurance covers the renter while driving, and what the renter pays after damage." },
    "photo": { "type": "blob", "description": "A photo of the car." }
  },
  "review": {
    "shared": ["subject", "score", "text", "offer", "evidence"],
    "fields": {
      "onTime": { "type": "choice", "description": "Whether the car was handed over, or returned, at the agreed time.", "values": ["yes", "no"] },
      "asAgreed": { "type": "choice", "description": "Whether the car was as the post said at pickup, or as it left at return.", "values": ["yes", "no"] }
    }
  },
  "payment": {
    "rental": {
      "windows": [ { "from": "payment", "offset": "+8d", "payerShare": 0 } ],
      "end": "pay",
      "arbiter": true
    }
  },
  "howDealsGo": "The owner and the renter agree in messages on the car, the dates, the deposit and how the keys change hands, and pay outside Forest. After the rental each may review the other. A review of the person who wrote the post names it."
}
